{
  "glossary_schema_version": 1,
  "source_locale": "be",
  "provenance": {
    "kind": "glossary",
    "reviewer": "owner",
    "evidence": "тэрміны выцягнутыя з зацверджаных перакладных набораў en/uk (міграцыя G06.05 #280 + рэв'ю G21.25 #558), анкераваныя на кананічныя запісы source.json; паходжанне кожнага тэрміна — у яго provenance па форме G21.27; дапоўнена de-тэрмінамі ў задачы G21.10 (#544): выбары занкерваныя на лакатары de-набору, сэмантычны рэвью — у results/G21.10.md; дапоўнена es-тэрмінамі ў задачы G21.11 (#545): выбары занкерваныя на лакатары es-набору, сэмантычны рэвью — у results/G21.11.md; дапоўнена fr-тэрмінамі ў задачы G21.12 (#546): выбары занкерваныя на лакатары fr-набору, сэмантычны рэвью — у results/G21.12.md; дапоўнена cs-тэрмінамі ў задачы G21.13 (#547): выбары занкерваныя на лакатары cs-набору, сэмантычны рэвью — у results/G21.13.md; дапоўнена zh-тэрмінамі ў задачы G21.46 (#670): выбары занкерваныя на лакатары zh-набору, тэрміны батарэі G21.39 §6.3 (корпус AOSP zh-rCN), рэвью — у results/G21.46.md"
  },
  "entries": [
    {
      "term": "guide",
      "meaning": "аўтарскі тэкставы гід па горадзе або месцы (кантэнт, не чалавек-экскурсавод); радкі каталога і карткі падказкі",
      "recordIds": [
        "native.chrome.guidesLink",
        "native.nearby.guideLabel",
        "native.guideHint.openHint"
      ],
      "locales": {
        "en": {
          "term": "guide",
          "provenance": {
            "status": "resolved",
            "kind": "reviewed-terminology",
            "term": "guide",
            "locator": "translations/en.json#native.nearby.guideLabel",
            "reason": "«Гід» → guide паўсюль у зацверджаным en-наборы (Guides →, Guide, the guide's description)",
            "date": "2026-10-05"
          }
        },
        "uk": {
          "term": "гід",
          "provenance": {
            "status": "resolved",
            "kind": "reviewed-terminology",
            "term": "гід",
            "locator": "translations/uk.json#native.nearby.guideLabel",
            "reason": "uk-запісы трымаюць беларускую форму «гід» даслоўна (Гіды →, Гід)",
            "date": "2026-10-05"
          }
        },
        "de": {
          "term": "Guide",
          "provenance": {
            "status": "resolved",
            "kind": "reviewed-terminology",
            "term": "Guide",
            "locator": "translations/de.json#native.nearby.guideLabel",
            "reason": "de трымае запазычаны Guide (Guides →, Guide, Guide-Beschreibung) — як en, кароткі і нэўтральны для каталога і карткі падказкі",
            "date": "2026-10-05"
          }
        },
        "es": {
          "term": "Guía",
          "provenance": {
            "status": "resolved",
            "kind": "reviewed-terminology",
            "term": "Guía",
            "locator": "translations/es.json#native.nearby.guideLabel",
            "reason": "es трымае запазычаны род Guía (Guías →, Guía) з жаночым родам кнігі-гіда — кароткае і звыклае слова каталога і карткі падказкі",
            "date": "2026-10-05"
          }
        },
        "fr": {
          "term": "guide",
          "provenance": {
            "status": "resolved",
            "kind": "reviewed-terminology",
            "term": "guide",
            "locator": "translations/fr.json#native.nearby.guideLabel",
            "reason": "fr трымае тую ж словаформу guide (Guides →, Guide, Description du guide) — супадзенне з en-канонам; род і апострафы ідуць з кантэксту радкоў",
            "date": "2026-10-05"
          }
        },
        "cs": {
          "term": "Průvodce",
          "provenance": {
            "status": "resolved",
            "kind": "reviewed-terminology",
            "term": "Průvodce",
            "locator": "translations/cs.json#native.nearby.guideLabel",
            "reason": "cs трымае ўласнае Průvodce (Průvodci →, Průvodce, Popis průvodce) — прыродны чэшскі тэрмін аўдыёгіда; чалавечы род трымаецца ва ўсіх радках",
            "date": "2026-10-05"
          }
        },
        "sv": {
          "term": "guide",
          "provenance": {
            "status": "resolved",
            "kind": "reviewed-terminology",
            "term": "guide",
            "locator": "translations/sv.json#native.nearby.guideLabel",
            "reason": "sv трымае запазычаны guide (Guider →, Guide, Öppna guidebeskrivningen) — як en, кароткі і нэўтральны для каталога і карткі падказкі",
            "date": "2026-10-05"
          }
        },
        "zh": {
          "term": "\u5BFC\u89C8",
          "provenance": {
            "status": "resolved",
            "kind": "reviewed-terminology",
            "term": "\u5BFC\u89C8",
            "locator": "translations/zh.json#native.nearby.guideLabel",
            "reason": "zh трымае \u5BFC\u89C8 у запісах (\u5BFC\u89C8 →, \u5BFC\u89C8, \u6253\u5F00\u5BFC\u89C8\u8BF4\u660E) — электронны аўдыягід па батарэі G21.39; \u5BFC\u6E38 (чалавек-экскурсавод) свядома не ўжываецца",
            "date": "2026-10-17"
          }
        }
      }
    },
    {
      "term": "stop",
      "meaning": "два сэнсы: імянік — кропка маршруту прагулкі (Кропкі: N, Кропка N, Наступная кропка), дзеянне — спыніць тэйзер месца (кнопка native.place.stopLabel); слоўнікавы тэрмін — імянік, дзеянне гл. анкеры",
      "recordIds": [
        "native.chrome.stopsCount",
        "native.chrome.stopNumber",
        "web.ui.nextStop",
        "native.place.stopLabel"
      ],
      "locales": {
        "en": {
          "term": "stop",
          "provenance": {
            "status": "resolved",
            "kind": "reviewed-terminology",
            "term": "stop",
            "locator": "translations/en.json#native.chrome.stopsCount",
            "reason": "імянік stop (Stops: N, Stop N, Next stop); дзеянне таксама stop (native.place.stopLabel: Stop) — сэнс разгортваецца кантэкстам экрана",
            "date": "2026-10-05"
          }
        },
        "uk": {
          "term": "точка",
          "provenance": {
            "status": "resolved",
            "kind": "reviewed-terminology",
            "term": "точка",
            "locator": "translations/uk.json#native.chrome.stopsCount",
            "reason": "імянік — точка (Точки: N, Точка N, Наступна точка); дзеянне — Зупинити (native.place.stopLabel): uk не змешвае сэнсы адным словам",
            "date": "2026-10-05"
          }
        },
        "de": {
          "term": "Station",
          "provenance": {
            "status": "resolved",
            "kind": "reviewed-terminology",
            "term": "Station",
            "locator": "translations/de.json#native.chrome.stopsCount",
            "reason": "імянік — Station (Stationen: N, Station N, Nächste Station) — звыклы нямецкі тэрмін кропак экскурсійнага маршруту; дзеянне спыніць тэйзер — асобнае «Stop» (native.place.stopLabel), uk-прэцэдэнт немешвання сэнсаў",
            "date": "2026-10-05"
          }
        },
        "es": {
          "term": "Parada",
          "provenance": {
            "status": "resolved",
            "kind": "reviewed-terminology",
            "term": "Parada",
            "locator": "translations/es.json#native.chrome.stopsCount",
            "reason": "імянік — Parada (Paradas: N, Parada N, Siguiente parada) — звыклы іспанскі тэрмін кропак маршруту; дзеянне спыніць тэйзер — асобнае «Detener» (native.place.stopLabel), uk/de-прэцэдэнт немешвання сэнсаў",
            "date": "2026-10-05"
          }
        },
        "fr": {
          "term": "étape",
          "provenance": {
            "status": "resolved",
            "kind": "reviewed-terminology",
            "term": "étape",
            "locator": "translations/fr.json#native.chrome.stopsCount",
            "reason": "імянік — étape (Étapes : N, Étape N, Prochaine étape) — звыклы французскі тэрмін кропкі экскурсійнага маршруту; дзеянне спыніць тэйзер — асобнае «Arrêter» (native.place.stopLabel), uk/de-прэцэдэнт немешвання сэнсаў",
            "date": "2026-10-05"
          }
        },
        "cs": {
          "term": "Zastavení",
          "provenance": {
            "status": "resolved",
            "kind": "reviewed-terminology",
            "term": "Zastavení",
            "locator": "translations/cs.json#native.chrome.stopsCount",
            "reason": "імянік — Zastavení (Zastavení: N, Zastavení N, Další zastavení) — звыклы чэшскі тэрмін кропкі маршруту; словаформа нязменная ў лічбах; дзеянне спыніць тэйзер — асобнае «Zastavit» (native.place.stopLabel), uk/de/es-прэцэдэнт немешвання сэнсаў",
            "date": "2026-10-05"
          }
        },
        "sv": {
          "term": "stopp",
          "provenance": {
            "status": "resolved",
            "kind": "reviewed-terminology",
            "term": "stopp",
            "locator": "translations/sv.json#native.chrome.stopsCount",
            "reason": "sv трымае стоп (ett) — словаформа інварыянтная ў лічбах (Stopp: 5, Stopp 3, Nästa stopp), правільна без ICU; дзеянне спыніць тэйзер — асобнае Stoppa",
            "date": "2026-10-05"
          }
        },
        "zh": {
          "term": "\u5730\u70B9",
          "provenance": {
            "status": "resolved",
            "kind": "reviewed-terminology",
            "term": "\u5730\u70B9",
            "locator": "translations/zh.json#native.chrome.stopsCount",
            "reason": "назоўнік — \u5730\u70B9 (\u5730\u70B9\uFF1AN, \u5730\u70B9 N, \u4E0B\u4E00\u4E2A\u5730\u70B9); кропкі маршруту пешай экскурсіі, не транспартнае \u5DF4\u58EB\u7AD9; дзеянне спыніць тэйзер — асобнае \u505C\u6B62 (native.place.stopLabel), uk/de/es/fr/cs-прэцэдэнт немешвання сэнсаў",
            "date": "2026-10-17"
          }
        }
      }
    },
    {
      "term": "walk",
      "meaning": "адзін актыўны праход па гідзе з жывой пазіцыяй (прагулка); сесія пачынаецца/спыняецца на экране Run, гісторыя — папярэднія праходы",
      "recordIds": [
        "native.chrome.walk",
        "native.chrome.currentWalk",